{
  "schema": "axm.living-city.community-institution/v0.6.0",
  "id": "community_repair_circle",
  "name": "Repair & Share Circle",
  "kind": "maker_circle",
  "placeId": "place_workshop",
  "capacity": 5,
  "tags": [
    "repair",
    "practical",
    "creativity",
    "care"
  ],
  "description": "People restore useful things, teach one another, and keep object history alive instead of treating replacement as progress.",
  "opening": {
    "days": [
      1,
      3,
      5,
      6
    ],
    "hour": 11,
    "closes": 21
  },
  "status": "active",
  "members": [
    {
      "id": "community_member_00170",
      "personId": "npc_012",
      "status": "left",
      "appliedDay": 1,
      "joinedDay": 1,
      "leftDay": 1,
      "participationCount": 0,
      "lastParticipationDay": null,
      "reasons": [
        "autonomous starting affinity in a newly seeded world"
      ],
      "seeded": true,
      "history": [
        {
          "day": 1,
          "hour": 7,
          "type": "joined",
          "message": "autonomous starting affinity in a newly seeded world"
        }
      ]
    },
    {
      "id": "community_member_00172",
      "personId": "npc_007",
      "status": "active",
      "appliedDay": 1,
      "joinedDay": 1,
      "leftDay": null,
      "participationCount": 4,
      "lastParticipationDay": 62,
      "reasons": [
        "autonomous starting affinity in a newly seeded world"
      ],
      "seeded": true,
      "history": [
        {
          "day": 1,
          "hour": 7,
          "type": "joined",
          "message": "autonomous starting affinity in a newly seeded world"
        }
      ]
    },
    {
      "id": "community_member_00174",
      "personId": "npc_022",
      "status": "left",
      "appliedDay": 1,
      "joinedDay": 1,
      "leftDay": 93,
      "participationCount": 3,
      "lastParticipationDay": 28,
      "reasons": [
        "autonomous starting affinity in a newly seeded world"
      ],
      "seeded": true,
      "history": [
        {
          "day": 1,
          "hour": 7,
          "type": "joined",
          "message": "autonomous starting affinity in a newly seeded world"
        },
        {
          "day": 93,
          "hour": 0,
          "type": "left",
          "message": "Autonomously changed direction without being punished."
        }
      ]
    },
    {
      "id": "community_member_00176",
      "personId": "npc_016",
      "status": "active",
      "appliedDay": 1,
      "joinedDay": 1,
      "leftDay": null,
      "participationCount": 7,
      "lastParticipationDay": 91,
      "reasons": [
        "autonomous starting affinity in a newly seeded world"
      ],
      "seeded": true,
      "history": [
        {
          "day": 1,
          "hour": 7,
          "type": "joined",
          "message": "autonomous starting affinity in a newly seeded world"
        }
      ]
    },
    {
      "id": "community_member_00178",
      "personId": "npc_023",
      "status": "left",
      "appliedDay": 1,
      "joinedDay": 1,
      "leftDay": 23,
      "participationCount": 2,
      "lastParticipationDay": 13,
      "reasons": [
        "autonomous starting affinity in a newly seeded world"
      ],
      "seeded": true,
      "history": [
        {
          "day": 1,
          "hour": 7,
          "type": "joined",
          "message": "autonomous starting affinity in a newly seeded world"
        },
        {
          "day": 23,
          "hour": 0,
          "type": "left",
          "message": "Autonomously changed direction without being punished."
        }
      ]
    },
    {
      "id": "community_member_00223",
      "personId": "player",
      "status": "active",
      "appliedDay": 1,
      "joinedDay": 1,
      "leftDay": null,
      "participationCount": 0,
      "lastParticipationDay": null,
      "reasons": [
        "explicit labeled waiting-state experiment"
      ],
      "seeded": false,
      "history": [
        {
          "day": 1,
          "hour": 7,
          "type": "waitlisted",
          "message": "explicit labeled waiting-state experiment"
        },
        {
          "day": 1,
          "hour": 7,
          "type": "promoted",
          "message": "A real membership place opened."
        }
      ]
    },
    {
      "id": "community_member_00872",
      "personId": "npc_020",
      "status": "left",
      "appliedDay": 23,
      "joinedDay": 23,
      "leftDay": 79,
      "participationCount": 1,
      "lastParticipationDay": 42,
      "reasons": [
        "autonomous interest and an available place"
      ],
      "seeded": false,
      "history": [
        {
          "day": 23,
          "hour": 0,
          "type": "joined",
          "message": "autonomous interest and an available place"
        },
        {
          "day": 79,
          "hour": 0,
          "type": "left",
          "message": "Autonomously changed direction without being punished."
        }
      ]
    },
    {
      "id": "community_member_02547",
      "personId": "npc_002",
      "status": "active",
      "appliedDay": 79,
      "joinedDay": 79,
      "leftDay": null,
      "participationCount": 1,
      "lastParticipationDay": 91,
      "reasons": [
        "autonomous interest and an available place"
      ],
      "seeded": false,
      "history": [
        {
          "day": 79,
          "hour": 0,
          "type": "joined",
          "message": "autonomous interest and an available place"
        }
      ]
    },
    {
      "id": "community_member_03406",
      "personId": "npc_012",
      "status": "active",
      "appliedDay": 107,
      "joinedDay": 107,
      "leftDay": null,
      "participationCount": 0,
      "lastParticipationDay": null,
      "reasons": [
        "autonomous interest and an available place"
      ],
      "seeded": false,
      "history": [
        {
          "day": 107,
          "hour": 0,
          "type": "joined",
          "message": "autonomous interest and an available place"
        }
      ]
    }
  ],
  "mentorIds": [
    "npc_016"
  ],
  "foundedDay": 1,
  "history": [
    {
      "id": "community_history_00160",
      "day": 1,
      "hour": 7,
      "type": "foundation",
      "message": "Repair & Share Circle entered the living city as optional community infrastructure.",
      "actorIds": [],
      "causes": [
        "deterministic community foundation",
        "membership does not control people"
      ],
      "evidence": {
        "capacity": 5,
        "placeId": "place_workshop"
      }
    },
    {
      "id": "community_history_00171",
      "day": 1,
      "hour": 7,
      "type": "member_joined",
      "message": "Uma Prins joined Repair & Share Circle.",
      "actorIds": [
        "npc_012"
      ],
      "causes": [
        "autonomous starting affinity in a newly seeded world"
      ],
      "evidence": {
        "membershipId": "community_member_00170",
        "capacity": 5,
        "activeMembers": 1
      }
    },
    {
      "id": "community_history_00173",
      "day": 1,
      "hour": 7,
      "type": "member_joined",
      "message": "Yara Visser joined Repair & Share Circle.",
      "actorIds": [
        "npc_007"
      ],
      "causes": [
        "autonomous starting affinity in a newly seeded world"
      ],
      "evidence": {
        "membershipId": "community_member_00172",
        "capacity": 5,
        "activeMembers": 2
      }
    },
    {
      "id": "community_history_00175",
      "day": 1,
      "hour": 7,
      "type": "member_joined",
      "message": "Joost Meijer joined Repair & Share Circle.",
      "actorIds": [
        "npc_022"
      ],
      "causes": [
        "autonomous starting affinity in a newly seeded world"
      ],
      "evidence": {
        "membershipId": "community_member_00174",
        "capacity": 5,
        "activeMembers": 3
      }
    },
    {
      "id": "community_history_00177",
      "day": 1,
      "hour": 7,
      "type": "member_joined",
      "message": "Liv Hendriks joined Repair & Share Circle.",
      "actorIds": [
        "npc_016"
      ],
      "causes": [
        "autonomous starting affinity in a newly seeded world"
      ],
      "evidence": {
        "membershipId": "community_member_00176",
        "capacity": 5,
        "activeMembers": 4
      }
    },
    {
      "id": "community_history_00179",
      "day": 1,
      "hour": 7,
      "type": "member_joined",
      "message": "Zeno Jansen joined Repair & Share Circle.",
      "actorIds": [
        "npc_023"
      ],
      "causes": [
        "autonomous starting affinity in a newly seeded world"
      ],
      "evidence": {
        "membershipId": "community_member_00178",
        "capacity": 5,
        "activeMembers": 5
      }
    },
    {
      "id": "community_history_00218",
      "day": 1,
      "hour": 7,
      "type": "opportunity_opened",
      "message": "Make something weird and small opened for day 2.",
      "actorIds": [],
      "causes": [
        "community rhythm",
        "optional participation"
      ],
      "evidence": {
        "opportunityId": "community_opportunity_00216"
      }
    },
    {
      "id": "community_history_00224",
      "day": 1,
      "hour": 7,
      "type": "member_waitlisted",
      "message": "Player entered the waiting state for Repair & Share Circle.",
      "actorIds": [
        "player"
      ],
      "causes": [
        "explicit labeled waiting-state experiment"
      ],
      "evidence": {
        "membershipId": "community_member_00223",
        "capacity": 5,
        "activeMembers": 5
      }
    },
    {
      "id": "community_history_00234",
      "day": 1,
      "hour": 7,
      "type": "waitlist_promoted",
      "message": "Player received an opening at Repair & Share Circle.",
      "actorIds": [
        "player"
      ],
      "causes": [
        "membership capacity opened",
        "oldest visible waiting state first"
      ],
      "evidence": {